Title,Description,URL,Request form,Access note,Subject categories,Data/resource types,Access model,Topic,Provider,Image
ABI/Inform,"Business research database providing scholarly articles, trade publications, company profiles, industry reports, and business news. Supports research in management, finance, accounting, marketing, entrepreneurship, and economics.",https://www.proquest.com/abicomplete/index?accountid=15172,,,Business & Economics; News & Media; Scholarly Literature,Company & Organization Data; Financial & Market Data; Market Research,External platform,"Company & Organization Data, Financial & Market Data, Market Research",ProQuest,../Images/Datasets/abi-inform.png
Ad*Access,"Digital archive of historical U.S. and Canadian advertisements from 1911 to 1955. Useful for research on marketing, consumer culture, media history, visual design, and advertising trends.",https://repository.duke.edu/dc/adaccess,,Requires users to register for an account with a valid Yale email address.,Business & Economics; News & Media; Humanities & History,Market Research; Historical Archives,Open access,"Market Research, Historical Archives",,../Images/Datasets/ad-access.png
Advertising Age,"News and analysis platform covering advertising, marketing, media, agencies, and brand strategy. Supports research on marketing trends, campaign strategy, and advertising industry developments.",https://library.yale.edu/eresources/access/access-ad-age?_ga=2.49974048.788554764.1679317615-416833816.1675090855,,,Business & Economics; News & Media,Market Research; News & Current Events; Government & International Statistics,External platform,"Market Research, News & Current Events, Government & International Statistics",,../Images/Datasets/advertising-age.png
American City Business Journals,"Collection of local business news, company information, and economic reporting from major U.S. metropolitan areas. Useful for regional business, entrepreneurship, and economic development research.",https://library.yale.edu/eresources/access/access-american-city-business-journals,,Requires users to request an individual account with a Yale email address.,Business & Economics; News & Media; Scholarly Literature,Company & Organization Data; News & Current Events; Government & International Statistics,External platform,"Company & Organization Data, News & Current Events, Government & International Statistics",,../Images/Datasets/american-city-business-journals.png
American Energy Society,"Energy information platform providing industry news, reports, white papers, podcasts, and market intelligence. Supports research on energy markets, climate policy, technology, and sustainability.",https://library.yale.edu/eresources/access/access-american-energy-society,,New users will need to register for an individual account using a valid Yale email address .,Energy & Environment; Business & Economics; Government & Public Policy,News & Current Events; ESG & Sustainability Data; Data Platform,External platform,"News & Current Events, ESG & Sustainability Data, Data Platform",,../Images/Datasets/american-energy-society.png
Associations Unlimited,"Directory of professional, trade, cultural, labor, and nonprofit organizations in the United States and abroad. Useful for identifying associations, professional networks, and organizational contacts.",https://yale.idm.oclc.org/login?URL=https://go.gale.com/ps/i.do?p=GDL&sw=w&u=29002&v=2.1&pg=BasicSearch&it=static&sid=bookmark-GDL,,"Descriptions and contact information for over 500 membership organizations from around the world, including professional and trade associations, labor unions, and cultural organizations. Included titles: Encyclopedia of Associations: National Organizations of the U.S., Encyclopedia of Associations: International Organizations, and Encyclopedia of Associations: Regional, State & Local Associations .",Social Sciences,Company & Organization Data; Trade & Supply Chain Data; Workforce & Career Data,External platform,"Company & Organization Data, Trade & Supply Chain Data, Workforce & Career Data",Gale,../Images/Datasets/associations-unlimited.png
Audit Analytics,"Database of corporate disclosures, audit information, accounting practices, regulatory filings, and compliance activity. Supports research in accounting, corporate governance, financial reporting, and regulation.",https://search.library.yale.edu/catalog/16525201,,Available via WRDS or the Audit Analytics website. Both options require users to register for an account with a valid Yale email address.,Business & Economics; Government & Public Policy,Financial & Market Data; News & Current Events; Data Platform,External platform,"Financial & Market Data, News & Current Events, Data Platform",,../Images/Datasets/audit-analytics.png
BBC Research,"Market research platform covering emerging technologies, healthcare, energy, materials, biotechnology, and industrial sectors. Useful for technology forecasting, industry analysis, and market assessment.",http://hdl.handle.net/10079/yuldb/yuldb1766,,,Energy & Environment; Health & Medicine; Business & Economics,Market Research; Health & Biomedical Data; Data Platform,External platform,"Market Research, Health & Biomedical Data, Data Platform",,../Images/Datasets/bbc-research.png
Bloomberg Terminal,"Professional financial data platform providing real-time market data, company information, economic indicators, analytics, and news. Widely used for investment, finance, and economic research.",https://guides.library.yale.edu/Bloomberg,,Available on dedicated workstations located at Marx Library and the School of Management.,Business & Economics; News & Media,Company & Organization Data; Financial & Market Data; News & Current Events,Workstation access,"Company & Organization Data, Financial & Market Data, News & Current Events",Bloomberg,../Images/Datasets/bloomberg-terminal.png
Bloomberg.com,"News and data platform covering global markets, business, economics, politics, technology, and policy. Supports research on current events, financial markets, and business trends.",https://web.library.yale.edu/access-bloombergcom,,Requires users to register for an individual account with a Yale email address.Bloomberg.com accounts are reset annually after the spring semester. Returning users may need to re-register with their @yale.edu address at that time.,Business & Economics; Government & Public Policy; News & Media,Financial & Market Data; News & Current Events; Real Estate & Property Data,External platform,"Financial & Market Data, News & Current Events, Real Estate & Property Data",Bloomberg,../Images/Datasets/bloomberg-com.png
Business Insider,"Digital news platform featuring reporting on business, technology, finance, careers, and global affairs. Useful for tracking companies, industries, labor markets, and emerging business trends.",https://library.yale.edu/eresources/access/access-business-insider,,Requires users to register for an account with a Yale email address.,Business & Economics; Social Sciences; News & Media,Company & Organization Data; Financial & Market Data; News & Current Events,External platform,"Company & Organization Data, Financial & Market Data, News & Current Events",,../Images/Datasets/business-insider.png
Business of Fashion Professional,"Industry intelligence platform covering global fashion markets, companies, retail strategy, and consumer trends. Supports research on fashion business, luxury markets, and brand strategy.",https://library.yale.edu/eresources/access/access-business-fashion?_ga=2.228768796.1813429910.1685970342-141142974.1682704224,,Requires users to register for an account with a Yale email address. The campus subscription does not include access to BoF Insights reports.,Business & Economics,Company & Organization Data; Market Research; Data Platform,External platform,"Company & Organization Data, Market Research, Data Platform",,../Images/Datasets/business-of-fashion-professional.png
Business Source Ultimate,"Comprehensive business database providing scholarly journals, trade publications, industry reports, SWOT analyses, case studies, and company profiles. Supports research across business disciplines.",https://yale.idm.oclc.org/login?URL=https://research-ebsco-com.yale.idm.oclc.org/c/bygvhg/topics,,,Business & Economics; Scholarly Literature,Company & Organization Data; Scholarly Indexes & Literature; Trade & Supply Chain Data,External platform,"Company & Organization Data, Scholarly Indexes & Literature, Trade & Supply Chain Data",EBSCO,../Images/Datasets/business-source-ultimate.png
Caixin Global,"English-language news source covering Chinese business, finance, economics, politics, and public policy. Useful for research on China's economy, markets, and regulatory environment.",https://web.library.yale.edu/access-caixin-global,,Requires users to register for an individual account with a Yale email address for access.,Energy & Environment; Business & Economics; Government & Public Policy,Financial & Market Data; News & Current Events,External platform,"Financial & Market Data, News & Current Events",,../Images/Datasets/caixin-global.png
Calcbench,"Financial statement database built from SEC XBRL filings of public companies. Supports accounting, auditing, financial analysis, and corporate reporting research.",https://web.library.yale.edu/access-calcbench,,Requires users to register for an individual account with a Yale email address for access.,Business & Economics,Company & Organization Data; Financial & Market Data; News & Current Events,External platform,"Company & Organization Data, Financial & Market Data, News & Current Events",,../Images/Datasets/calcbench.png
Capital IQ,"Financial intelligence platform providing company financials, transactions, ownership data, market information, and professional profiles worldwide. Widely used for business, investment, and economic research.","https://library.yale.edu/eresources/access/access-capital-iq, https://guides.library.yale.edu/capiq",,Requires registering an individual account with a Yale email address. Individuals who do not want to create an individual account can use S&P NetAdvantage for similar functionality.,Business & Economics,Company & Organization Data; Financial & Market Data; Data Platform,External platform,"Company & Organization Data, Financial & Market Data, Data Platform",S&P,../Images/Datasets/capital-iq.png
Carbon Pulse,"News and intelligence platform covering carbon markets, emissions trading, greenhouse gas pricing, climate policy, and sustainability initiatives. Supports environmental economics and climate governance research.",https://library.yale.edu/eresources/access/access-carbon-pulse,,Requires users to register for an individual account with a Yale email address for access.,Energy & Environment; Business & Economics; Government & Public Policy,News & Current Events; ESG & Sustainability Data; Data Platform,External platform,"News & Current Events, ESG & Sustainability Data, Data Platform",,../Images/Datasets/carbon-pulse.png
CB Insights,"Database tracking startups, investors, venture capital activity, funding rounds, acquisitions, and emerging industries. Useful for entrepreneurship, innovation, and technology market research.",https://library.yale.edu/eresources/access/access-cb-insights,,Requires users to register for an account using a Yale email address. Note: Expert Intelligence reports are not available with academic or university accounts.,Business & Economics; Technology & Innovation,Financial & Market Data; Market Research; Data Platform,External platform,"Financial & Market Data, Market Research, Data Platform",,../Images/Datasets/cb-insights.png
CDP Climate Data,"Company-reported environmental and climate disclosure data covering emissions, sustainability practices, and supply-chain activity. Supports ESG, climate risk, and corporate sustainability research.",https://library.yale.edu/eresources/access/access-carbon-disclosure-project-public-climate-change-data?_ga=2.105318723.1326972826.1556550690-1266232307.1547737145,,,Energy & Environment; Business & Economics,Company & Organization Data; ESG & Sustainability Data,External platform,"Company & Organization Data, ESG & Sustainability Data",,../Images/Datasets/cdp-climate-data.png
CEIC Data,"Global economic and financial database containing macroeconomic, sector, regional, and alternative data from official and commercial sources. Supports comparative economic and policy research.",https://library.yale.edu/eresources/access/access-ceic-data,,,Business & Economics; Government & Public Policy,Financial & Market Data; Data Platform,External platform,"Financial & Market Data, Data Platform",,../Images/Datasets/ceic-data.png
Centralbanking.com,"Information resource focused on central banking, monetary policy, financial stability, banking regulation, and financial technologies. Useful for research on economic policy and financial systems.",https://yale.idm.oclc.org/login?URL=https://www.centralbanking.com/,,,Business & Economics; Government & Public Policy,Financial & Market Data,External platform,Financial & Market Data,,../Images/Datasets/centralbanking-com.png
Conference Board,"Source for economic indicators, business research, and management intelligence. Supports research on economic conditions, consumer confidence, workforce trends, and organizational performance.",https://library.yale.edu/eresources/access/access-conference-board,,Off-campus users must be logged in to Yale’s VPN OR must create an account with their @yale.edu email address.,Business & Economics; Social Sciences,Company & Organization Data; Market Research; Government & International Statistics,External platform,"Company & Organization Data, Market Research, Government & International Statistics",,../Images/Datasets/conference-board.png
CoreLogic,"Property, mortgage, deed, tax, and real estate market database covering U.S. housing markets. Supports research in housing, urban economics, finance, and real estate.",https://search.library.yale.edu/catalog/99149180943408651,https://forms.office.com/pages/responsepage.aspx?id=u76M3Tkh-E20EU4-h6vrXGa2PpecL_VHoOa9Jy4XGNVUMVJTT1BXNDdHVVAyREk5N09BWVdCVFE5RiQlQCN0PWcu&route=shorturl,,Business & Economics; GIS & Spatial Data,Financial & Market Data; Survey & Polling Data; Real Estate & Property Data,Locally hosted at Yale,"Financial & Market Data, Survey & Polling Data, Real Estate & Property Data",,../Images/Datasets/corelogic.png
Crunchbase,"Database of private and public companies, investors, funding rounds, acquisitions, and startup activity. Supports research on entrepreneurship, innovation ecosystems, and venture capital.",https://search.library.yale.edu/catalog/99159676243408651,https://forms.office.com/pages/responsepage.aspx?id=u76M3Tkh-E20EU4-h6vrXGa2PpecL_VHoOa9Jy4XGNVUQTVRTE40N1kwVk5FTzJTNjJOVzRPWU5IUCQlQCN0PWcu&route=shorturl,Data is available by request. Use the access link in the Quicksearch record to get started.,Business & Economics; Technology & Innovation,Company & Organization Data; Financial & Market Data; Data Platform,Locally hosted at Yale,"Company & Organization Data, Financial & Market Data, Data Platform",,../Images/Datasets/crunchbase.png
Data Axle,"Business directory containing current and historical information on millions of U.S. and Canadian companies. Useful for business demographics, market analysis, and geographic research.",https://library.yale.edu/eresources/access/access-data-axle-reference-solutions,,,Business & Economics; Social Sciences; GIS & Spatial Data,Company & Organization Data; News & Current Events; Geospatial & Mapping Data,External platform,"Company & Organization Data, News & Current Events, Geospatial & Mapping Data",,../Images/Datasets/data-axle.png
Data Explr,"Historical database of U.S. private companies with information on sales, employment, industry classification, location, and ownership. Supports longitudinal business and economic research.",http://hdl.handle.net/10079/yuldb/yuldb2852,,Data for 1981 and 1984 are not available. An individual Data Exlpr account is required to access this data.,Business & Economics; GIS & Spatial Data; Humanities & History,Company & Organization Data; Geospatial & Mapping Data; Historical Archives,External platform,"Company & Organization Data, Geospatial & Mapping Data, Historical Archives",,../Images/Datasets/data-explr.png
Datacenter Knowledgebase (451 Research),"Global database of data center facilities, infrastructure, capacity, utilization, and market activity. Useful for research on cloud computing, digital infrastructure, and technology markets.",,https://forms.office.com/pages/responsepage.aspx?id=u76M3Tkh-E20EU4-h6vrXGa2PpecL_VHoOa9Jy4XGNVUQTFTSEtMRk84SVJTSUVBT0RDSzZSWkQ0WSQlQCN0PWcu&route=shorturl,Requires users to request an individual account with a Yale email address.,Business & Economics; Technology & Innovation,Data Platform,Locally hosted at Yale,Data Platform,,../Images/Datasets/datacenter-knowledgebase-451-research.png
Datastream,"Historical financial database containing securities prices, economic indicators, commodities, bonds, and market data. Supports quantitative finance, investment analysis, and economic research.",https://guides.library.yale.edu/Workspace/Datastream,https://forms.office.com/pages/responsepage.aspx?id=u76M3Tkh-E20EU4-h6vrXGa2PpecL_VHoOa9Jy4XGNVURDdNSUpFT0JDMEw2WlNCOEQ4NE1KSklNUyQlQCN0PWcu&route=shorturl,,Business & Economics; Humanities & History,Financial & Market Data; Government & International Statistics; Historical Archives,Locally hosted at Yale,"Financial & Market Data, Government & International Statistics, Historical Archives",LSEG,../Images/Datasets/datastream.png
Dewey Data,"Platform providing access to licensed third-party research datasets across healthcare, workforce, consumer behavior, transportation, and other domains. Useful for discovering specialized datasets.",https://www.deweydata.io/,,"Click ""Sign in"" and enter your yale.edu email address.",Health & Medicine; Social Sciences,Market Research; Health & Biomedical Data; Workforce & Career Data,External platform,"Market Research, Health & Biomedical Data, Workforce & Career Data",,../Images/Datasets/dewey-data.png
eCommerceDB,"Global e-commerce database covering online retailers, revenue, market development, competitors, traffic, and digital commerce indicators. Supports retail, consumer behavior, and digital economy research.",https://library.yale.edu/eresources/access/access-ecommercedb,,Also accessible via Statista.,Business & Economics; Technology & Innovation,Market Research; Government & International Statistics; Data Platform,External platform,"Market Research, Government & International Statistics, Data Platform",,../Images/Datasets/ecommercedb.png
EconLit,"Comprehensive index of economics literature including journal articles, books, working papers, dissertations, conference proceedings, and reviews. Supports scholarly research in economics and related fields.",https://yale.idm.oclc.org/login?URL=http://search.proquest.com/econlit?accountid=15172,,,Business & Economics; Humanities & History; Scholarly Literature,Scholarly Indexes & Literature,External platform,Scholarly Indexes & Literature,ProQuest,../Images/Datasets/econlit.png
EIU Viewpoint,"Political and economic intelligence platform providing country analysis, forecasts, policy insights, and risk assessments. Useful for international business, public policy, and global market research.",https://viewpoint-eiu-com.yale.idm.oclc.org/,,,Business & Economics; Government & Public Policy,Market Research; Government & International Statistics; Data Platform,External platform,"Market Research, Government & International Statistics, Data Platform",,../Images/Datasets/eiu-viewpoint.png
eMarketer,"Market data and analysis platform focused on digital advertising, social media, e-commerce, retail, and consumer technology. Supports research on digital markets and media trends.",http://hdl.handle.net/10079/yuldb/yuldb1980,,,Business & Economics; Social Sciences; News & Media,Financial & Market Data; Market Research; Data Platform,External platform,"Financial & Market Data, Market Research, Data Platform",,../Images/Datasets/emarketer.png
EMIS,"Market intelligence platform providing company, industry, country, and news data for emerging and established markets. Supports global business, market, and economic research.",https://library.yale.edu/eresources/access/access-emis,,"If you are prompted to login, select the Guest Access option.",Business & Economics; News & Media,Company & Organization Data; News & Current Events; Government & International Statistics,External platform,"Company & Organization Data, News & Current Events, Government & International Statistics",,../Images/Datasets/emis.png
Esri Business Analyst,"Web-based GIS and market analysis platform with demographic, consumer, employment, and location data. Supports spatial analysis, site selection, and market research.",https://guides.library.yale.edu/onlinemapping/BA,,"Requires an individual account. For more information and to request an account, visit: Online Mapping Resources: Esri Business Analyst Web Apps.",Business & Economics; Social Sciences; GIS & Spatial Data,Market Research; Geospatial & Mapping Data; Workforce & Career Data,External platform,"Market Research, Geospatial & Mapping Data, Workforce & Career Data",Esri,../Images/Datasets/esri-business-analyst.png
Factiva,"Global news database with current and archival coverage from newspapers, magazines, newswires, and business sources. Supports news, company, industry, and policy research.",https://yale.idm.oclc.org/login?URL=http://hdl.handle.net/10079/yuldb/yuldb493,,"Per our license agreement, Factiva may not be used for text mining projects.",Business & Economics; Government & Public Policy; News & Media,Company & Organization Data; News & Current Events; Real Estate & Property Data,External platform,"Company & Organization Data, News & Current Events, Real Estate & Property Data",EBSCO,../Images/Datasets/factiva.png
FactSet,"Financial data and analytics platform covering global companies, markets, securities, estimates, and economic data. Supports investment research, financial modeling, and market analysis.",http://guides.library.yale.edu/factset,,Access to FactSet is made possible by Yale School of Management. FactSet Workstation is available for Faculty & PhD Students.,Business & Economics,Company & Organization Data; Financial & Market Data; Data Platform,Workstation access,"Company & Organization Data, Financial & Market Data, Data Platform",FactSet,../Images/Datasets/factset.png
Finaeon,"Historical financial and economic time-series database covering countries, markets, exchange rates, interest rates, commodities, inflation, and securities. Supports long-run financial and economic research.",http://web.library.yale.edu/access-global-financial-data,,,Business & Economics; Humanities & History,Financial & Market Data; Historical Archives; Data Platform,External platform,"Financial & Market Data, Historical Archives, Data Platform",United Nations,../Images/Datasets/finaeon.png
Financial Times,"Digital news source covering global business, finance, economics, politics, and markets. Useful for current awareness and research on international business and economic issues.",https://yale.idm.oclc.org/login?URL=https://library.yale.edu/eresources/access/access-financial-times,,,Business & Economics; Government & Public Policy; News & Media,Financial & Market Data; News & Current Events; Government & International Statistics,External platform,"Financial & Market Data, News & Current Events, Government & International Statistics",,../Images/Datasets/financial-times.png
Foundation Directory Online Professional,"Database of U.S. foundations, grantmakers, corporate giving programs, public charities, grants, and IRS filings. Supports philanthropy, nonprofit, and funding research.",https://yale.idm.oclc.org/login?URL=http://hdl.handle.net/10079/yuldb/yuldb515,,,Social Sciences,Company & Organization Data; Data Platform,External platform,"Company & Organization Data, Data Platform",,../Images/Datasets/foundation-directory-online-professional.png
Frost and Sullivan,"Market research platform covering technology, healthcare, transportation, defense, chemicals, electronics, communications, and other industries. Useful for industry analysis and market forecasting.",https://member.frost.com/login,,,Health & Medicine; Business & Economics; Technology & Innovation,Market Research; Health & Biomedical Data; Data Platform,External platform,"Market Research, Health & Biomedical Data, Data Platform",,../Images/Datasets/frost-and-sullivan.png
Gale Business Insights,"Business information platform providing company profiles, SWOT analyses, industry coverage, market share data, histories, chronologies, and articles. Supports company and industry research.",https://yale.idm.oclc.org/login?URL=http://infotrac.galegroup.com/itweb/29002?db=BIG,,,Business & Economics,Company & Organization Data; Market Research; Data Platform,External platform,"Company & Organization Data, Market Research, Data Platform",Gale,../Images/Datasets/gale-business-insights.png
Gallup Analytics,"Polling and survey data platform covering U.S. and global public opinion. Supports research on attitudes, behavior, social trends, and cross-national comparisons.",https://yale.idm.oclc.org/login?URL=https://library.yale.edu/eresources/access/access-gallup-analytics,Yale subscribes to individual response data contact researchdata@yale.edu for access.,,Social Sciences,Survey & Polling Data; Data Platform,External platform,"Survey & Polling Data, Data Platform",,../Images/Datasets/gallup-analytics.png
