Title,Description,URL,Request form,Access note,Subject categories,Data/resource types,Access model,Topic,Provider,Image
Gartner,"Information technology research platform providing reports, analysis, and trends on IT markets, vendors, and strategy. Supports technology management and digital transformation research.",http://business.yale.edu/gartner/go,,,Business & Economics; Technology & Innovation,Data Platform,External platform,Data Platform,,../Images/Datasets/gartner.png
Global Development Finance,"World Bank dataset on financial flows, external debt, and financial indicators for developing countries. Supports research on development finance and international economic conditions.",http://data.worldbank.org/data-catalog/global-financial-development,,,Business & Economics,Financial & Market Data; Government & International Statistics,Open access,"Financial & Market Data, Government & International Statistics",World Bank,../Images/Datasets/global-development-finance.png
GlobalData Medical and Pharmaceutical Intelligence Centers,"Market research platform covering medical device and pharmaceutical industries. Supports research on healthcare markets, drug development, competitive intelligence, and industry trends.",https://library.yale.edu/eresources/access/access-globaldata,,,Health & Medicine; Business & Economics,Market Research; Government & International Statistics; Health & Biomedical Data,External platform,"Market Research, Government & International Statistics, Health & Biomedical Data",,../Images/Datasets/globaldata-medical-and-pharmaceutical-intelligence-centers.png
GoinGlobal,"Career and employment information platform with country guides, job search resources, visa information, salary data, and workplace advice. Supports global career and labor market research.",https://yale.idm.oclc.org/login?url=http://online.goinglobal.com/default.aspx,,,Business & Economics; Social Sciences,Market Research; Government & International Statistics; Workforce & Career Data,External platform,"Market Research, Government & International Statistics, Workforce & Career Data",,../Images/Datasets/goinglobal.png
GuideStar Pro,"Nonprofit organization database with information on programs, finances, leadership, and IRS filings. Useful for nonprofit, philanthropy, civic sector, and organizational research.",https://library.yale.edu/eresources/access/access-guidestar,,"For assistance with downloading lists with more than 1000 results, please contact business.reference@yale.edu.",Business & Economics; Social Sciences,Company & Organization Data; Financial & Market Data; Data Platform,External platform,"Company & Organization Data, Financial & Market Data, Data Platform",,../Images/Datasets/guidestar-pro.png
Handbooks in Economics,"Full-text collection of scholarly handbooks in economics, finance, econometrics, and related fields. Supports literature review and advanced disciplinary research.",https://www.sciencedirect.com/browse/journals-and-books?subject=economics-econometrics-and-finance,,,Business & Economics; Humanities & History; Scholarly Literature,Financial & Market Data; Scholarly Indexes & Literature,External platform,"Financial & Market Data, Scholarly Indexes & Literature",Elsevier,../Images/Datasets/handbooks-in-economics.png
Harvard Business Publishing eBooks Collection,"Ebook collection covering management, leadership, entrepreneurship, strategy, human resources, and related business topics. Useful for teaching, professional development, and business research.","https://yale.idm.oclc.org/login?url=https://search.ebscohost.com/login.aspx?authtype=ip,uid&custid=s5164239&groupid=main&profile=ehost&defaultdb=e076mww",,,Business & Economics,Company & Organization Data; Government & International Statistics; Scholarly Indexes & Literature,External platform,"Company & Organization Data, Government & International Statistics, Scholarly Indexes & Literature",EBSCO,../Images/Datasets/harvard-business-publishing-ebooks-collection.png
IBISWorld,"Industry research platform with reports on market size, trends, performance, risks, major companies, and forecasts. Supports industry analysis, business planning, and market research.",https://library.yale.edu/eresources/access/access-ibisworld,,"Due to licensing restrictions with IBISWorld, users are limited to fewer than 50 downloads per session. Exceeding this limit may result in a university-wide loss of access to this resource.",Business & Economics,Company & Organization Data; Market Research; Data Platform,External platform,"Company & Organization Data, Market Research, Data Platform",,../Images/Datasets/ibisworld.png
IEA Statistics Package,"Energy statistics resource from the International Energy Agency. Supports research on energy production, consumption, trade, prices, and energy policy across countries.",https://guides.library.yale.edu/iea,,,Energy & Environment; Government & Public Policy,Financial & Market Data; Market Research; Government & International Statistics,External platform,"Financial & Market Data, Market Research, Government & International Statistics",,../Images/Datasets/iea-statistics-package.png
ImpactAlpha,"News and analysis source covering impact investing, sustainable finance, social enterprise, and market-based approaches to social change. Supports ESG and social impact research.",https://library.yale.edu/eresources/access/access-impactalpha,,Requires users to register for an individual account with a Yale email address.,Energy & Environment; Business & Economics; Social Sciences,Financial & Market Data; News & Current Events; ESG & Sustainability Data,External platform,"Financial & Market Data, News & Current Events, ESG & Sustainability Data",,../Images/Datasets/impactalpha.png
Indiastat,"Statistical database providing India-specific socioeconomic, industry, demographic, and government data. Supports regional, policy, development, and market research on India.",https://library.yale.edu/eresources/access/access-indiastat,,,Business & Economics; Government & Public Policy; Social Sciences,Market Research; Government & International Statistics; Data Platform,External platform,"Market Research, Government & International Statistics, Data Platform",,../Images/Datasets/indiastat.png
Inside Philanthropy,"News and information platform covering foundations, major donors, grantmaking, philanthropy jobs, and funding opportunities. Supports research on philanthropy and nonprofit funding.",https://library.yale.edu/eresources/access/access-inside-philanthropy,,Requires users to register for an individual account.,Social Sciences; News & Media,Company & Organization Data; News & Current Events; Workforce & Career Data,External platform,"Company & Organization Data, News & Current Events, Workforce & Career Data",,../Images/Datasets/inside-philanthropy.png
International Financial Statistics - IMF,"IMF statistical database covering international and domestic finance, monetary indicators, exchange rates, prices, production, and national accounts. Supports macroeconomic and international finance research.",http://data.imf.org/IFS,,,Business & Economics; Government & Public Policy,Financial & Market Data; Market Research; Government & International Statistics,Open access,"Financial & Market Data, Market Research, Government & International Statistics",IMF,../Images/Datasets/international-financial-statistics-imf.png
JSTOR,"Digital archive of scholarly journals, books, and primary sources across many disciplines. Supports literature reviews and historical research in business and related fields.",http://hdl.handle.net/10079/yuldb/yuldb1517,,,Business & Economics; Humanities & History; Scholarly Literature,Scholarly Indexes & Literature; Historical Archives,External platform,"Scholarly Indexes & Literature, Historical Archives",JSTOR,../Images/Datasets/jstor.png
Kanopy,"Streaming video platform offering educational films and documentaries across a range of subject areas. Useful for teaching, course support, and media-based research.",https://search.library.yale.edu/catalog/12778063,,,News & Media,Data Platform,External platform,Data Platform,,../Images/Datasets/kanopy.png
Leadership Connect,"Directory of leaders and organizations in business, government, and nonprofit sectors in the United States. Useful for contact research and organizational mapping.",https://library.yale.edu/eresources/access/access-leadership-connect,,Requires users to sign in with an @Yale.edu email address. Users will be directed to the Yale CAS sign-in page. Note: The export function is not available with our subscription.,Business & Economics; Government & Public Policy; Social Sciences,Company & Organization Data; Geospatial & Mapping Data,External platform,"Company & Organization Data, Geospatial & Mapping Data",,../Images/Datasets/leadership-connect.png
LSEG,"Financial markets platform providing company financials, filings, estimates, transactions, market data, and analyst research. Supports investment, corporate finance, and market research.",https://guides.library.yale.edu/Workspace/,,Requires users to register for an individual account.,Business & Economics,Company & Organization Data; Financial & Market Data; Market Research,External platform,"Company & Organization Data, Financial & Market Data, Market Research",LSEG,../Images/Datasets/lseg.png
LSEG Tick History,"Historical intraday market data source with time-and-sales, quotes, and market-depth data for futures. Supports high-frequency finance and market microstructure research.",https://guides.library.yale.edu/LSEG_Tick_History,,email to request access: business.reference@yale.edu,Business & Economics; Humanities & History,Financial & Market Data; Historical Archives,External platform,"Financial & Market Data, Historical Archives",LSEG,../Images/Datasets/lseg-tick-history.png
Making of the Modern World,"Digital archive of economic and business literature published from 1450 through 1850. Supports historical research on commerce, political economy, and social thought.",http://hdl.handle.net/10079/yuldb/yuldb859,,,Business & Economics; Government & Public Policy; Social Sciences,Scholarly Indexes & Literature; Historical Archives,External platform,"Scholarly Indexes & Literature, Historical Archives",,../Images/Datasets/making-of-the-modern-world.png
"Market Research & American Business, 1935-1965","Digital archive of market research reports and consumer studies from mid-twentieth-century American business. Supports research on advertising, consumer culture, and business history.",https://yale.idm.oclc.org/login?URL=http://www.consumerculture.amdigital.co.uk/,,,Business & Economics; News & Media; Humanities & History,Market Research; Historical Archives,External platform,"Market Research, Historical Archives",,../Images/Datasets/market-research-american-business-1935-1965.png
MarketResearch.com Academic,"Market research platform providing reports on consumer, demographic, lifestyle, industrial, and product markets. Supports industry analysis, market sizing, and consumer research.",https://yale.idm.oclc.org/login?url=https://www.marketresearch.com/academic/,,,Business & Economics; Social Sciences,Market Research; Data Platform,External platform,"Market Research, Data Platform",,../Images/Datasets/marketresearch-com-academic.png
Media Radar 360,"Advertising intelligence platform covering advertising expenditures across television, radio, magazines, newspapers, and other media. Supports media planning and advertising market research.",https://yale.idm.oclc.org/login?URL=https://yale.idm.oclc.org/login?url=https://edu.app.vivvix.com,,,Business & Economics; News & Media,Market Research; News & Current Events; Data Platform,External platform,"Market Research, News & Current Events, Data Platform",,../Images/Datasets/media-radar-360.png
Mergent Archives,"Historical corporate document archive including corporate manuals, municipal manuals, and annual reports. Supports company history, financial history, and archival business research.",https://yale.idm.oclc.org/login?url=https://www.mergentarchives.com/search.php,,,Business & Economics; Humanities & History,Company & Organization Data; Financial & Market Data; Historical Archives,External platform,"Company & Organization Data, Financial & Market Data, Historical Archives",,../Images/Datasets/mergent-archives.png
Mergent Intellect,"Global business directory with public and private company data, executive contacts, and industry research from D&B Hoovers. Supports company and market research.",https://yale.idm.oclc.org/login?URL=https://yale.idm.oclc.org/login?URL=https://www.mergentintellect.com,,,Business & Economics,Company & Organization Data; Market Research,External platform,"Company & Organization Data, Market Research",,../Images/Datasets/mergent-intellect.png
Mergent Municipal Bond Database,"Dataset of municipal bond attributes with historical coverage dating back several decades. Supports fixed income, public finance, and municipal market research.",http://search.library.yale.edu/catalog/14077868,,,Business & Economics; Government & Public Policy; Humanities & History,Financial & Market Data; Market Research; Historical Archives,External platform,"Financial & Market Data, Market Research, Historical Archives",,../Images/Datasets/mergent-municipal-bond-database.png
Mintel GNPD,"Global product database tracking new consumer packaged goods across food, beverage, household, beauty, health, and pet sectors. Supports product innovation and market research.",https://library.yale.edu/eresources/access/access-mintel?_ga=2.202669273.931541240.1636380257-883986010.1630510795,,Requires users to create a profile using your @yale.edu email address. Find step-by-step instructions for accessing Mintel GNPD in Yale Business Answers Now.,Health & Medicine; Business & Economics; Technology & Innovation,Market Research; Health & Biomedical Data; Data Platform,External platform,"Market Research, Health & Biomedical Data, Data Platform",Mintel,../Images/Datasets/mintel-gnpd.png
Mintel Reports,"Consumer market research platform with reports on U.S. and global markets, consumer attitudes, segmentation, and purchasing behavior. Supports marketing and consumer research.",http://hdl.handle.net/10079/yuldb/yuldb902,,,Business & Economics; News & Media,Market Research; Data Platform,External platform,"Market Research, Data Platform",Mintel,../Images/Datasets/mintel-reports.png
Moody's CRE,"Commercial real estate database with property data, rent levels, vacancy rates, sales comparables, forecasts, and market trends. Supports real estate and urban economics research.",https://library.yale.edu/eresources/access/access-moodys,https://forms.office.com/pages/responsepage.aspx?id=u76M3Tkh-E20EU4-h6vrXGa2PpecL_VHoOa9Jy4XGNVUNlVINUhVVUZNMTJFRFgyNjdQM0lCMklNTiQlQCN0PWcu&route=shorturl,Requires users to request an individual account with a Yale email address.,Business & Economics; GIS & Spatial Data,Survey & Polling Data; Real Estate & Property Data; Data Platform,External platform,"Survey & Polling Data, Real Estate & Property Data, Data Platform",Moody's,../Images/Datasets/moody-s-cre.png
Moody's Default & Recovery Database,"Credit risk database covering ratings, defaults, and recovery data for global sovereign and corporate debt securities. Supports fixed income and credit risk research.",https://library.yale.edu/eresources/access/access-moodys,https://forms.office.com/pages/responsepage.aspx?id=u76M3Tkh-E20EU4-h6vrXGa2PpecL_VHoOa9Jy4XGNVUNlVINUhVVUZNMTJFRFgyNjdQM0lCMklNTiQlQCN0PWcu&route=shorturl,Requires users to request an individual account with a Yale email address.,Business & Economics,Financial & Market Data; Data Platform,External platform,"Financial & Market Data, Data Platform",Moody's,../Images/Datasets/moody-s-default-recovery-database.png
Morningstar Direct,"Investment database and analytics platform covering funds, indexes, portfolios, ownership, and performance data worldwide. Supports investment analysis and asset management research.",https://guides.library.yale.edu/MorningstarDirect,,Available at Marx Library on a dedicated workstation.,Business & Economics,Company & Organization Data; Financial & Market Data; Data Platform,Workstation access,"Company & Organization Data, Financial & Market Data, Data Platform",,../Images/Datasets/morningstar-direct.png
New York Times,"Digital news source providing current and archival reporting on politics, business, culture, science, and global affairs. Supports current awareness and news research.",https://library.yale.edu/eresources/access/access-nytcom,,,Business & Economics; Government & Public Policy; News & Media,News & Current Events; Real Estate & Property Data,External platform,"News & Current Events, Real Estate & Property Data",,../Images/Datasets/new-york-times.png
Nexis Uni,"Full-text news, business, legal, and company information database. Supports research using newspapers, magazines, transcripts, legal sources, and company profiles.",http://hdl.handle.net/10079/yuldb/yuldb2398,,,Business & Economics; News & Media,Company & Organization Data; News & Current Events; Data Platform,External platform,"Company & Organization Data, News & Current Events, Data Platform",,../Images/Datasets/nexis-uni.png
OECD iLibrary,"OECD platform providing books, reports, journals, and statistical data on economics, policy, development, education, environment, and society. Supports comparative policy research.",http://hdl.handle.net/10079/yuldb/yuldb975,,,Energy & Environment; Business & Economics; Government & Public Policy,Government & International Statistics; Scholarly Indexes & Literature; Data Platform,External platform,"Government & International Statistics, Scholarly Indexes & Literature, Data Platform",OECD,../Images/Datasets/oecd-ilibrary.png
Orbis,"Global company database covering public and private firms, ownership structures, financials, and corporate relationships. Valuable for international business and organizational research.",https://yale.idm.oclc.org/login?url=https://orbis.bvdinfo.com/ip,,Point in-time historical data available by request,Business & Economics,Company & Organization Data; Financial & Market Data; Government & International Statistics,External platform,"Company & Organization Data, Financial & Market Data, Government & International Statistics",Moody's,../Images/Datasets/orbis.png
Orbis Historical,"Historical company dataset from Orbis providing point-in-time information for longitudinal business research. Supports analysis of firm characteristics, ownership, and financial data over time.",,https://forms.office.com/pages/responsepage.aspx?id=u76M3Tkh-E20EU4-h6vrXGa2PpecL_VHoOa9Jy4XGNVUQ0lDR1NIMkwxUVRPUVNIWTZMV1FCVzc2QSQlQCN0PWcu,,Business & Economics; Humanities & History,Company & Organization Data; Financial & Market Data; Historical Archives,Locally hosted at Yale,"Company & Organization Data, Financial & Market Data, Historical Archives",Moody's,../Images/Datasets/orbis-historical.png
Orbis Intellectual Property,"Patent and company intelligence platform linking global patent data to corporate information. Supports research on innovation, intellectual property, technology strategy, and firms.",https://yale.idm.oclc.org/login?URL=https://orbisip-r1.bvdinfo.com/ip,,,Business & Economics; GIS & Spatial Data; Technology & Innovation,Company & Organization Data; Survey & Polling Data; Real Estate & Property Data,External platform,"Company & Organization Data, Survey & Polling Data, Real Estate & Property Data",Moody's,../Images/Datasets/orbis-intellectual-property.png
Panjiva,"Global trade database with import and export records, suppliers, buyers, products, and shipment trends. Supports supply chain, trade, and sourcing research.",,https://forms.office.com/pages/responsepage.aspx?id=u76M3Tkh-E20EU4-h6vrXGa2PpecL_VHoOa9Jy4XGNVUNUxHUEEyOEI4WDNRRVhJMzI3SVA1M01QQyQlQCN0PWcu&route=shorturl,Requires users to request an individual account with a Yale email address.,General Research,Market Research; Trade & Supply Chain Data; Data Platform,Locally hosted at Yale,"Market Research, Trade & Supply Chain Data, Data Platform",,../Images/Datasets/panjiva.png
Passport,"Market research platform from Euromonitor with consumer, industry, country, and market data. Supports international market analysis, consumer trends, and business research.",http://web.library.yale.edu/access-passport,,,Business & Economics,Financial & Market Data; Market Research; Government & International Statistics,External platform,"Financial & Market Data, Market Research, Government & International Statistics",Euromonitor,../Images/Datasets/passport.png
Pharmaprojects,"Pharmaceutical research and development database tracking drugs by company, disease, therapeutic class, and development phase. Supports drug pipeline and biomedical market research.",http://hdl.handle.net/10079/yuldb/yuldb2273,,Requires users to register for an individual account.,Health & Medicine; Business & Economics; GIS & Spatial Data,Company & Organization Data; Market Research; Government & International Statistics,External platform,"Company & Organization Data, Market Research, Government & International Statistics",,../Images/Datasets/pharmaprojects.png
Pitchbook,"Private capital database covering companies, investors, funds, deals, exits, and service providers. Supports venture capital, private equity, and entrepreneurship research.",https://library.yale.edu/eresources/access/access-pitchbook,,"Requires users to sign in with an @Yale.edu email address. Users will be directed to the Yale CAS sign-in page. Do not click ""Log in without SSO"" even if you had an individual account previously. Commercial use is prohibited. Users are limited to 10 downloads per day and 25 downloads per month. (1 download = 1 row of data on an Excel file). Accounts will automatically be reset annually on May 31.",Business & Economics,Company & Organization Data; Financial & Market Data; Data Platform,External platform,"Company & Organization Data, Financial & Market Data, Data Platform",,../Images/Datasets/pitchbook.png
PolicyMap,"Interactive mapping platform combining demographic, housing, health, economic, and policy data from public and proprietary sources. Supports place-based research and spatial analysis.",https://www.policymap.com/newmaps/e/yale,,,Health & Medicine; Business & Economics; Government & Public Policy,Geospatial & Mapping Data; Real Estate & Property Data; Health & Biomedical Data,External platform,"Geospatial & Mapping Data, Real Estate & Property Data, Health & Biomedical Data",,../Images/Datasets/policymap.png
Political Risk Yearbook,"Country risk publication providing political, financial, and economic risk assessments for international business and investment. Supports global strategy and policy research.",https://yale.idm.oclc.org/login?url=https://epub.prsgroup.com/customer/pry/,,,Business & Economics; Government & Public Policy,Financial & Market Data; Government & International Statistics,External platform,"Financial & Market Data, Government & International Statistics",,../Images/Datasets/political-risk-yearbook.png
Politico Pro,"Policy intelligence platform covering legislative, regulatory, and political developments, including energy and environment news. Supports government, policy, and advocacy research.",http://hdl.handle.net/10079/yuldb/yuldb2498,,,Energy & Environment; Government & Public Policy; GIS & Spatial Data,News & Current Events; Government & International Statistics; Geospatial & Mapping Data,External platform,"News & Current Events, Government & International Statistics, Geospatial & Mapping Data",,../Images/Datasets/politico-pro.png
Preqin,"Alternative assets database covering private equity, private debt, real estate, infrastructure, natural resources, and hedge funds. Supports private markets and investment research.",http://web.library.yale.edu/access-preqin,,Private data from Preqin is available in WRDS.,Business & Economics; GIS & Spatial Data,Financial & Market Data; Real Estate & Property Data; Data Platform,External platform,"Financial & Market Data, Real Estate & Property Data, Data Platform",,../Images/Datasets/preqin.png
PrivCo,"Business and financial database focused on major private companies, including venture-backed, family-owned, and private-equity-owned firms. Supports private company and market research.",https://yale.idm.oclc.org/login?URL=http://hdl.handle.net/10079/yuldb/yuldb1801,,Requires users to sign up for an account using a Yale email address.,Business & Economics,Company & Organization Data; Financial & Market Data; Market Research,External platform,"Company & Organization Data, Financial & Market Data, Market Research",,../Images/Datasets/privco.png
ProQuest Dissertations & Theses Global,"Comprehensive database of dissertations and theses from universities worldwide. Supports literature reviews, graduate research, and discovery of emerging scholarship.",https://yale.idm.oclc.org/login?URL=https://search.proquest.com/pqdtglobal/index?accountid=15172,,,Humanities & History; Scholarly Literature,Scholarly Indexes & Literature; Data Platform,External platform,"Scholarly Indexes & Literature, Data Platform",ProQuest,../Images/Datasets/proquest-dissertations-theses-global.png
Proquest Historical Annual Reports,"Digital archive of annual reports from major North American companies over more than a century. Supports corporate history, financial history, and business research.",http://hdl.handle.net/10079/yuldb/yuldb648,,,Business & Economics; Humanities & History; Technology & Innovation,Company & Organization Data; Financial & Market Data; Historical Archives,External platform,"Company & Organization Data, Financial & Market Data, Historical Archives",ProQuest,../Images/Datasets/proquest-historical-annual-reports.png
